canonical_name,category,subcategory,tier_group,aliases,source_field_hints,canonical_url,description,is_positive,is_active
Berkeley M.E.T.,university_program,joint_degree,tier_3,"berkeley met;berkeley m.e.t.;management entrepreneurship technology;berkeley management entrepreneurship and technology","activities_honors;education_description",https://met.berkeley.edu,UC Berkeley dual-degree program — Haas Business + EECS engineering. Highly selective.,TRUE,TRUE
Penn M&T,university_program,joint_degree,tier_3,"penn m&t;penn mt;jerome fisher;jerome fisher program;management and technology;penn management and technology","activities_honors;education_description",https://fisher.wharton.upenn.edu,Penn's Jerome Fisher Program in Management & Technology — Wharton + Engineering dual degree. Very selective.,TRUE,TRUE
Lehigh IBE,university_program,joint_degree,tier_3,"lehigh ibe;ibe;integrated business and engineering;lehigh integrated business and engineering","activities_honors;education_description",https://ibe.lehigh.edu,Lehigh's Integrated Business and Engineering Honors Program.,TRUE,TRUE
USC Iovine and Young Academy,university_program,interdisciplinary,tier_3,"iovine and young;usc iovine;iovine young academy;iyc;iovine academy","activities_honors;education_description",https://iovine-young.usc.edu,USC's interdisciplinary academy founded by Jimmy Iovine and Andre Young (Dr. Dre). Highly selective.,TRUE,TRUE
Penn State Schreyer Honors College,university_program,honors_college,tier_3,"penn state schreyer;schreyer honors college;schreyer;psu schreyer","activities_honors;education_description",https://www.shc.psu.edu,Penn State's selective honors college.,TRUE,TRUE
Stanford CS+X,university_program,joint_degree,tier_3,"stanford cs+x;cs+x;stanford cs plus x","activities_honors;education_description",https://cs.stanford.edu/academics/undergraduate,Stanford's CS+X programs combining CS with a humanities or arts discipline (e.g. CS+Music).,TRUE,TRUE
Princeton Converse Program,university_program,entrepreneurship,tier_3,"princeton converse;converse program;keller center converse;princeton keller center converse","activities_honors;education_description",https://kellercenter.princeton.edu,Princeton's Keller Center entrepreneurship program/course.,TRUE,TRUE
UT Austin SEAL,university_program,entrepreneurship,tier_3,"ut austin seal;texas seal;ut seal","activities_honors;education_description",,UT Austin's Student Engineering Acceleration Lab (entrepreneurship-focused program).,TRUE,TRUE
