canonical_name,category,subcategory,tier_group,aliases,source_field_hints,canonical_url,description,is_positive,is_active,is_searchable
Cornell Kessler Fellows,university_fellowship,operator_track,tier_3,kessler fellows;cornell kessler;kessler fellowship;cornell kessler fellows,activities_honors;education_description,https://www.engineering.cornell.edu/students/student-experience/clubs-and-organizations/kessler-fellows-program,Cornell's selective entrepreneurship fellowship at the College of Engineering.,true,true,false
Harvard HUTIF,university_fellowship,operator_track,tier_3,harvard hutif;hutif;harvard undergraduate tech innovation fellowship,activities_honors;education_description,"",Harvard Undergraduate Tech Innovation Fellowship — selective tech entrepreneurship program.,true,true,false
Penn ELITE Fellowship,university_fellowship,operator_track,tier_3,penn elite;penn elite fellowship;elite fellowship penn,activities_honors;education_description,"",Penn's selective entrepreneurship/tech fellowship.,true,true,false
Stanford Mayfield Fellows Program,university_fellowship,operator_track,tier_3,mayfield fellows;stanford mayfield;mayfield fellowship program;mayfield fellows program,activities_honors;education_description,https://mfp.stanford.edu,Stanford's selective entrepreneurship fellowship — operator-track. 12 students/year.,true,true,false
USC Viterbi Tech Innovation Fellowship,university_fellowship,operator_track,tier_3,usc viterbi tech innovation;viterbi tech innovation fellowship;viterbi innovation fellowship,activities_honors;education_description,"",USC Viterbi School of Engineering tech innovation fellowship.,true,true,false
Yale Tsai CITY Summer Fellowship,university_fellowship,operator_track,tier_3,yale tsai city;tsai city fellowship;tsai city summer fellowship;yale tsai city summer fellowship,activities_honors;education_description,https://tsaicity.yale.edu,Yale's Tsai Center for Innovative Thinking summer entrepreneurship fellowship.,true,true,false
